<?xml version="1.0" encoding="UTF-8"?>
<dataroot xmlns:od="urn:schemas-microsoft-com:officedata" xmlns:xsi="http://www.w3.org/2001/XMLSchema-instance"  xsi:noNamespaceSchemaLocation="Branches.xsd" generated="2018-12-09T20:39:47">
<Branches>
<BranchID>1</BranchID>
<BranchName>Europe</BranchName>
</Branches>
<Branches>
<BranchID>2</BranchID>
<BranchName>North America</BranchName>
</Branches>
<Branches>
<BranchID>3</BranchID>
<BranchName>Scandinavia</BranchName>
</Branches>
<Branches>
<BranchID>4</BranchID>
<BranchName>South America</BranchName>
</Branches>
</dataroot>
